{"query":"knowledge","scope":"public-safe","limit":20,"max_chars":12000,"groups":{"sources":[],"facts":[],"human_notes":[{"classification":{"kind":"note","subtype":"idea","role":"human"},"path":"notes/ideas/example.md","object_id":"note_01JSTAG7N9Q3V5X8Y2Z4A6B8D0","section_id":"sec_core_idea","segment_id":"seg_aaaaaaaaaaaaaaaaaaaaaaaaaaaaaaaaaaaaaaaaaaaaaaaaaaaaaaaaaaaaaaaa","ordinal":0,"title":"Example","snippet":"Knowledge matters.","score":-1.0,"tags":[],"visibility":"public","record_status":"active","citations":[],"public_audit":{"eligible":true}}],"snippets":[]},"exclusions":[],"character_count":18,"truncated":false,"excluded_count":0,"notice":"This result is not a Phase 6B publish certification."}
